{
  "confidence": 0.6,
  "locale": "ru",
  "gazetteer_path": "data/gazetteer.db",
  "spacy_model": "ru_core_news_md",
  "max_file_size_mb": 2.0,
  "degraded_mode": true,
  "user_agent": "TaxonFinder/0.1.0",
  "inaturalist": {
    "base_url": "https://api.inaturalist.org",
    "timeout": 120,
    "rate_limit": 1.0,
    "burst_limit": 5,
    "max_retries": 3,
    "cache_enabled": true,
    "cache_path": "cache/taxonfinder.db",
    "cache_ttl_days": 7
  },
  "llm_extractor": {
    "enabled": false,
    "provider": "ollama",
    "model": "llama3.1",
    "url": "http://localhost:11434",
    "timeout": 120,
    "prompt_file": "prompts/llm_extractor.txt",
    "chunk_strategy": "paragraph",
    "min_chunk_words": 50,
    "max_chunk_words": 500
  },
  "llm_enricher": {
    "enabled": false,
    "provider": "ollama",
    "model": "llama3.1",
    "url": "http://localhost:11434",
    "timeout": 30,
    "prompt_file": "prompts/llm_enricher.txt"
  }
  ,
  "logging": {
    "console_level": "DEBUG",
    "file_level": "DEBUG",
    "log_file": "logs/taxonfinder.log"
  }
}
